{
  "schema_version": "cavra.aispm.report_alert_remediation_closure.v1",
  "product": "CAVRA",
  "edition": "enterprise",
  "contract_visibility": "public_contract",
  "generated_at": "2026-06-11T11:42:00Z",
  "tenant_ref": "tenant:opaque-public-contract-sample",
  "closure": {
    "closure_ref": "remediation-closure:opaque-report-alert",
    "plan_ref": "remediation-plan:opaque-report-alert",
    "source_alert_ref": "alert:opaque-evidence-room-access",
    "source_incident_ref": "incident:opaque-report-delivery-and-access-review",
    "final_status": "closed",
    "closed_at": "2026-06-12T10:12:00Z",
    "owner_role": "security_operations",
    "residual_risk_level": "low"
  },
  "completed_tasks": [
    {
      "task_ref": "task:opaque-revoke-access",
      "title": "Revoke stale evidence-room access",
      "owner_role": "security_operations",
      "completed_at": "2026-06-11T11:36:00Z",
      "evidence_ref": "cavra://evidence/redacted/evidence-room-access-revoked",
      "approval_ref": "approval:opaque-not-required"
    },
    {
      "task_ref": "task:opaque-review-recipient-policy",
      "title": "Review recipient and evidence-room policy",
      "owner_role": "grc",
      "completed_at": "2026-06-12T08:35:00Z",
      "evidence_ref": "cavra://evidence/redacted/recipient-policy-reviewed",
      "approval_ref": "approval:opaque-recipient-policy-review"
    }
  ],
  "final_approvals": [
    {
      "approval_ref": "approval:opaque-closure",
      "approval_type": "plan_closure",
      "approver_role": "ciso",
      "decision": "approved",
      "decided_at": "2026-06-12T09:45:00Z",
      "evidence_ref": "cavra://evidence/redacted/remediation-closure-approved"
    }
  ],
  "control_updates": [
    {
      "control_ref": "control:opaque-evidence-room-access",
      "update_type": "policy_threshold",
      "owner_role": "platform_security",
      "final_status": "completed",
      "evidence_ref": "cavra://evidence/redacted/control-threshold-updated"
    },
    {
      "control_ref": "control:opaque-recipient-governance",
      "update_type": "recipient_policy",
      "owner_role": "grc",
      "final_status": "completed",
      "evidence_ref": "cavra://evidence/redacted/recipient-policy-control-updated"
    }
  ],
  "residual_risk": {
    "risk_level": "low",
    "accepted": true,
    "accepted_by_role": "ciso",
    "acceptance_ref": "risk-acceptance:opaque-remediation-closure",
    "review_due_at": "2026-07-12T10:12:00Z",
    "rationale_summary": "Compensating controls and revised evidence-room policy reduce residual risk."
  },
  "post_incident_review": {
    "review_ref": "post-incident-review:opaque-report-alert",
    "completed": true,
    "completed_at": "2026-06-12T10:00:00Z",
    "facilitator_role": "security_leadership",
    "lessons_learned_refs": [
      "lesson:opaque-evidence-room-review-window"
    ],
    "follow_up_required": true
  },
  "communications": {
    "internal_update_sent": true,
    "executive_update_sent": true,
    "customer_notification_required": false,
    "customer_notification_sent": false,
    "communication_ref": "communication:opaque-remediation-closure-summary"
  },
  "evidence": {
    "closure_digest_ref": "digest:opaque-remediation-closure",
    "remediation_plan_ref": "remediation-plan:opaque-report-alert",
    "alert_drilldown_ref": "alert-drilldown:opaque-evidence-room-access",
    "incident_packet_ref": "incident-packet:opaque-report-alert",
    "closure_manifest_ref": "closure-manifest:opaque-remediation-complete",
    "immutable_store_ref": "immutable:opaque-remediation-closure",
    "evidence_refs": [
      "cavra://evidence/redacted/remediation-plan-completed",
      "cavra://evidence/redacted/remediation-closure-approved",
      "cavra://evidence/redacted/post-incident-review-completed"
    ]
  },
  "controls": {
    "all_tasks_completed": true,
    "final_approval_required": true,
    "residual_risk_recorded": true,
    "post_incident_review_recorded": true,
    "immutable_closure_required": true,
    "raw_payloads_excluded": true
  },
  "redaction": {
    "recipient_addresses_included": false,
    "operator_identity_included": false,
    "auditor_identity_included": false,
    "approver_identity_included": false,
    "ip_address_included": false,
    "download_urls_included": false,
    "raw_report_content_included": false,
    "provider_response_included": false,
    "customer_records_included": false,
    "private_remediation_details_included": false,
    "tenant_drilldown_records_included": false,
    "secrets_included": false,
    "payload_handling": "remediation_closure_metadata_only"
  },
  "enterprise_boundaries": {
    "closure_workflow": "requires_cavra_enterprise",
    "approval_identity_resolution": "requires_cavra_enterprise",
    "residual_risk_store": "requires_cavra_enterprise",
    "post_incident_review_store": "requires_cavra_enterprise",
    "communication_delivery": "requires_cavra_enterprise",
    "immutable_closure_store": "requires_cavra_enterprise",
    "evidence_chain_store": "requires_cavra_enterprise",
    "license_enforcement": "requires_cavra_enterprise"
  }
}
